{
  "contract_version": "1.0.0",
  "job_id": "01jrk8m4q4xv2v8d4d4ymf5htp",
  "tenant_id": "01jrk8m4q4xv2v8d4d4ymf5tnt",
  "document_id": "01jrk8m4q4xv2v8d4d4ymf5doc",
  "document_revision": 1,
  "submitted_at": "2026-04-27T08:14:32.451+08:00",
  "submitted_by": "user_01jrk8m4q4xv2v8d4d4ymf5usr",
  "pages": [
    {
      "page_id": "01jrk8m4q4xv2v8d4d4ymf5p02",
      "page_number": 1,
      "source": {
        "kind": "https",
        "url": "https://signed.example.com/tenant/01jrk/doc/01jrk/page-001.png?sig=abc",
        "url_expires_at": "2026-04-27T08:29:32.451+08:00",
        "byte_size": 921600,
        "mime_type": "image/png"
      }
    }
  ],
  "ocr_options": { "languages": ["zh-Hans"] },
  "preprocessing": { "deskew": "auto", "upscale_low_dpi": true, "target_dpi_floor": 200 },
  "priority": 75,
  "retry": {
    "max_attempts": 3,
    "backoff": "exponential",
    "base_delay_ms": 2000,
    "max_delay_ms": 60000,
    "attempt": 1
  },
  "metadata": {}
}
